{
  "checks": {
    "all_frozen_implementation_inputs_match": true,
    "all_real_execution_boundaries_remain_closed": true,
    "only_one_remote_bundle_inventory_gate_opens": true,
    "public_crypto_material_is_bound_without_claiming_secret": true,
    "reader_decrypts_in_memory_and_never_extracts": true,
    "reader_persists_hashes_not_plaintext_paths": true,
    "result_and_validation_schemas_are_closed": true,
    "runner_has_no_network_appworld_import_install_or_model": true,
    "runner_preflight_is_revision_clean_external_and_dependency_guarded": true,
    "runner_reads_only_exact_apps_member": true,
    "seven_synthetic_tests_pass_without_warning": true,
    "wheel_and_apps_bundle_identity_are_exact": true
  },
  "confirmatory_claim_authorized": false,
  "data_downloaded": false,
  "gpu_used": false,
  "implementation_config_sha256": "1c2fa17c9f671c60ed7a9c3a88fb2dd4913ef5c897b6b7b327367b688dff1957",
  "inventory_implementation_sha256": "a25c0129519179483dcaf6020117976107ed00067dbb5c1a75b944df9676da9e",
  "model_loaded": false,
  "model_run_authorized": false,
  "next_gate": "run_one_remote_aggregate_only_apps_bundle_inventory",
  "one_remote_bundle_inventory_authorized": true,
  "passed": true,
  "protected_plaintext_persisted": false,
  "real_apps_bundle_decrypted": false,
  "run_kind": "proper_v2_3_appworld_apps_bundle_inventory_implementation_validation",
  "runner_sha256": "b20454ef43e13e759347d57b0476acc21b7a5d8e61da5a5f7d857a0a9891646d",
  "schema_version": 1,
  "source_extracted": false,
  "source_install_authorized": false,
  "static_api_inventory_authorized": false,
  "synthetic_bundle_decrypted": true,
  "task_or_api_data_read": false,
  "tests_bundle_decrypted": false,
  "tests_bundle_read": false,
  "tests_run": 7
}
